{
  "id": "apple-catcher",
  "title": "苹果丰收",
  "version": "1.0.0",
  "description": "移动篮子接住苹果,小心毒苹果和炸弹。连击加分,考验反应力的休闲小游戏。",
  "genre": "休闲·反应",
  "languages": [
    "zh"
  ],
  "engine": "single-html",
  "entry": "index.html",
  "input": [
    "mouse",
    "touch"
  ],
  "recommendedSize": {
    "width": 480,
    "height": 720
  },
  "orientation": "portrait",
  "mobileSupported": true,
  "externalNetwork": [],
  "saveVersion": 1,
  "resources": [
    {
      "path": "index.html",
      "type": "runtime"
    },
    {
      "path": "params.json",
      "type": "runtime"
    }
  ],
  "store": {
    "cover": "store/cover.png",
    "screenshots": [
      "store/screenshot-1.png"
    ],
    "video": "",
    "instructions": "store/instructions.md",
    "changelog": "store/changelog.md"
  },
  "platforms": {
    "station": {
      "status": "live",
      "projectId": "apple-catcher"
    },
    "itch": {
      "status": "ready",
      "projectId": "",
      "note": "web.zip 已通过 itch 校验(index.html 在根/相对路径/无外部依赖);截图与操作说明待补,尚未提交审核"
    }
  },
  "licenses": "store/LICENSE.md",
  "notes": "已在 game-station 上线(live)。store 素材已生成(cover/screenshot/instructions/changelog)。itch: ready(可导出,缺 projectId,未提交)。 浏览器玩法测试通过(game test --browser: 加载/开始/操作,0 控制台错误)。"
}
