{
  "id": "word-maze",
  "title": "词林迷阵",
  "version": "1.0.0",
  "description": "在汉字魔法森林中,通过组合/拆分汉字改变环境并推动剧情,例如‘日’+‘月’=‘明’。核心循环:阅读故事→选择字词操作→观察反馈→推进章节。",
  "genre": "文字冒险+解谜",
  "languages": [
    "zh"
  ],
  "engine": "single-html",
  "entry": "index.html",
  "input": [
    "mouse",
    "touch"
  ],
  "recommendedSize": {
    "width": 480,
    "height": 854
  },
  "orientation": "portrait",
  "mobileSupported": true,
  "externalNetwork": [],
  "saveVersion": 1,
  "resources": [
    {
      "path": "index.html",
      "type": "runtime"
    },
    {
      "path": "params.json",
      "type": "runtime"
    }
  ],
  "store": {
    "cover": "store/cover.png",
    "screenshots": [
      "store/screenshot-1.png"
    ],
    "video": "",
    "instructions": "store/instructions.md",
    "changelog": "store/changelog.md"
  },
  "platforms": {
    "station": {
      "status": "live",
      "projectId": "word-maze"
    },
    "itch": {
      "status": "ready",
      "projectId": "",
      "note": "web.zip 已通过 itch 校验(index.html 在根/相对路径/无外部依赖);截图与操作说明待补,尚未提交审核"
    }
  },
  "licenses": "store/LICENSE.md",
  "notes": "已在 game-station 上线(live)。P1 补齐 params.json(消除 404),store 素材已生成。itch: ready。"
}
